{
  "schema_version": "1.0.0",
  "stand": "2026-10-31",
  "hinweis_rechtsverbindlichkeit": "Diese Datei enthaelt VORSCHLAGSWERTE fuer Ergebnisfelder (Kanzleifelder), abgeleitet aus den vom Mandanten erhobenen Tatsachenfeldern. Sie ersetzt NICHT die fachliche Pruefung durch eine berufsrechtlich zugelassene Person. Ein Flow, der Erfassungs-Chat (DE/AO/erfassungs-chat/) oder ein kuenftiger ELSTER-Bot darf aus dieser Datei einen Vorschlag berechnen und anzeigen, aber NIEMALS automatisch in SharePoint oder ELSTER eintragen, ohne dass die Kanzlei den Vorschlag vorher bestaetigt hat. Rechtsstand-Angaben je Norm sind nach bestem Wissen zum genannten Datum erstellt; insbesondere kuerzlich reformierte Normen (Paragraf 19 UStG ab 1.1.2025, Paragraf 141 AO-Schwellen, Paragraf 20 UStG-Schwelle) sind vor produktivem Einsatz durch die Kanzlei zu verifizieren. Als 'unsicher' markierte Regelzeilen duerfen nicht als gesicherte Rechtsauskunft behandelt werden, sondern nur als Diskussionsgrundlage.",
  "offene_fragen_global": [
    "Kleinunternehmerregelung (small_business_rule, Paragraf 19 UStG) und Ist-Besteuerung (vat_taxation_method, Paragraf 20 UStG): Schwellenwerte wurden zum 1.1.2025 (Paragraf 19 UStG) bzw. 1.1.2024 (Paragraf 20 UStG) reformiert. Bitte die in dieser Datei angegebenen Schwellen (25.000 EUR / 100.000 EUR bzw. 800.000 EUR) sowie die Behandlung des Gruendungsjahres (keine Hochrechnung mehr?) gegen den aktuellen Rechtsstand pruefen.",
    "Paragraf 141 AO-Schwellen (Buchfuehrungspflicht, relevant fuer profit_determination_method): in dieser Datei mit 800.000 EUR Umsatz / 80.000 EUR Gewinn angegeben (Stand nach Viertem Corona-Steuerhilfegesetz). Bitte aktuellen Rechtsstand bestaetigen.",
    "Zustaendiges Finanzamt (tax_office): kann nicht als kategorialer Wert abgeleitet werden, da die konkrete Finanzamts-Zustaendigkeit je Bundesland unterschiedlich organisiert ist. Diese Datei bestimmt nur den Anknuepfungspunkt (Ort der Geschaeftsleitung bzw. Sitz bzw. Betriebsstaette); die Zuordnung zum konkreten Finanzamt erfordert einen Abgleich mit dem jeweiligen Zustaendigkeitsverzeichnis. Bitte klaeren, ob/wie ein solcher Abgleich automatisiert werden soll oder ob das dauerhaft manuelle Kanzleiarbeit bleibt.",
    "tax_office (0_Fallsteuerung): Grundbesitz-Lage wird aktuell nur unstrukturiert in asset_management_type (Freitext, Liste 1) erfasst - kein eigenes Lagestaat-/Lageort-Feld fuer Grundbesitz. Relevant fuer § 18 AO (gesonderte Feststellung bei Grundbesitz). Soll ein strukturiertes Feld ergaenzt werden?",
    "tax_office (0_Fallsteuerung): ../ustzustv-laendertabelle.json ist bewusst NICHT befuellt (Risiko einer falschen Finanzamt-Zuordnung bei geraten Angaben). Bitte die aktuelle Anlage zur UStZustV pruefen und die Tabelle befuellen, sobald Kapazitaet besteht - danach kann der Auslands-USt-Sonderfall in dieser Regel automatisiert vorschlagen statt 'manuelle Pruefung'.",
    "tax_office (0_Fallsteuerung): fuer die allgemeine Ertragsteuer-Zustaendigkeit (§§ 18-21 AO) wurde kein im Rahmen dieser Aufgabe pruefbarer, lizenzrechtlich nutzbarer GemFA-Datenexport des BZSt/der Laender identifiziert - bleibt 'manuelle Pruefung'. Falls der Kanzlei eine konkrete GemFA-Datenquelle bekannt ist, bitte mitteilen.",
    "target_notification (0_Fallsteuerung) / § 138 Abs. 2 Satz 1 Nr. 3 AO: die Aggregation unmittelbarer+mittelbarer Quoten sowie der Anschaffungskosten ueber mehrere 4_Beteiligte_und_Quoten-Datensaetze derselben Person/desselben Zielunternehmens ist als Prozessschritt dokumentiert, aber nicht in der strukturierten 'bedingung' des Einzeldatensatzes abgebildet (das waere datensatzuebergreifend und sprengt den Rahmen eines einzelnen booleschen Ausdrucks ueber EIN Objekt). Bitte bestaetigen, ob das als Flow-/Kanzlei-Prozessschritt ausreicht oder eine datensatzuebergreifende Aggregationsregel (z. B. eigenes 'Beteiligungsgruppe'-Objekt) noetig ist.",
    "2_Unternehmens_Gruendungsmodul.formation_origin: ueberschneidet sich inhaltlich mit predecessor_exists/transformation_event (beide bereits vorhanden). Bewusst als eigene Tatsachenfrage beibehalten (Nils-Vorgabe), da 'Uebernahme oder Erwerb' weiter gefasst ist (z. B. Share Deal). Bitte bestaetigen, ob eine Konsistenzpruefung zwischen diesen Feldern im Flow ergaenzt werden soll."
  ],
  "regeln": [
    {
      "id": "0_Fallsteuerung__tax_office_country",
      "ergebnisfeld": {
        "liste": "0_Fallsteuerung",
        "internal_name": "tax_office_country",
        "display_name": "Land des Finanzamts"
      },
      "beschreibung": "Bestimmt das Land (bei Deutschland: den Anknuepfungspunkt fuer das zustaendige Bundesland/Finanzamt), dessen Steuerbehoerde fuer DIESEN Fall zustaendig ist. Klassifizierung als Ergebnisfeld am 31.10.2026 von Nils bestaetigt (zuvor als offene Frage markiert, siehe PR #24): die Zustaendigkeit ist Folge einer Rechtspruefung (Sitz, Ort der Geschaeftsleitung, Betriebsstaetten-/Grundstueckslage, Wohnsitz bei natuerlichen Personen), nicht vom Mandanten selbst zu bestimmen.",
      "wertetyp": "kategorial",
      "normen": [
        {
          "gesetz": "AO",
          "fundstelle": "§ 19",
          "rechtsstand": "2026-10-31",
          "kurzbeschreibung": "natuerliche Personen: Wohnsitz/gewoehnlicher Aufenthalt"
        },
        {
          "gesetz": "AO",
          "fundstelle": "§ 20 Abs. 1",
          "rechtsstand": "2026-10-31",
          "kurzbeschreibung": "Koerperschaften/Personenvereinigungen: Ort der Geschaeftsleitung"
        },
        {
          "gesetz": "AO",
          "fundstelle": "§ 20 Abs. 2",
          "rechtsstand": "2026-10-31",
          "kurzbeschreibung": "hilfsweise Sitz, wenn Geschaeftsleitung im Ausland"
        },
        {
          "gesetz": "AO",
          "fundstelle": "§ 20 Abs. 3",
          "rechtsstand": "2026-10-31",
          "kurzbeschreibung": "auslaendische Koerperschaft ohne inlaendische Geschaeftsleitung: Finanzamt der inlaendischen Betriebsstaette"
        },
        {
          "gesetz": "AO",
          "fundstelle": "§ 18",
          "rechtsstand": "2026-10-31",
          "kurzbeschreibung": "gesonderte Feststellung bei Grundbesitz/Personengesellschaften: Lage des Grundbesitzes bzw. Ort der Geschaeftsleitung"
        }
      ],
      "tatsachenfelder": [
        {
          "liste": "1_Allgemeiner_Stammblock",
          "internal_name": "party_type"
        },
        {
          "liste": "1_Allgemeiner_Stammblock",
          "internal_name": "address_type"
        },
        {
          "liste": "1_Allgemeiner_Stammblock",
          "internal_name": "country"
        },
        {
          "liste": "1_Allgemeiner_Stammblock",
          "internal_name": "legal_form_category"
        },
        {
          "liste": "1_Allgemeiner_Stammblock",
          "internal_name": "legal_form_jurisdiction"
        },
        {
          "liste": "1_Allgemeiner_Stammblock",
          "internal_name": "legal_form_foreign_country"
        },
        {
          "liste": "3_Personen_und_Vertretung",
          "internal_name": "usual_workplace_country"
        },
        {
          "liste": "3_Personen_und_Vertretung",
          "internal_name": "works_elsewhere"
        },
        {
          "liste": "5_Betriebsstaetten",
          "internal_name": "country"
        },
        {
          "liste": "5_Betriebsstaetten",
          "internal_name": "site_type"
        }
      ],
      "ableitungszeilen": [
        {
          "bedingung_text": "party_type = 'Person' und address_type = 'Inland'.",
          "ergebniswert": "Deutschland",
          "unsicher": false,
          "bedingung": {
            "und": [
              {
                "vergleich": {
                  "feld": "1_Allgemeiner_Stammblock.party_type",
                  "op": "eq",
                  "wert": "Person"
                }
              },
              {
                "vergleich": {
                  "feld": "1_Allgemeiner_Stammblock.address_type",
                  "op": "eq",
                  "wert": "Inland"
                }
              }
            ]
          },
          "ausnahmen": "Setzt Wohnsitz oder gewoehnlichen Aufenthalt im Inland voraus (§ 19 AO); bei Wohnsitz im Ausland siehe naechste Zeile.",
          "offene_frage_an_nils": null
        },
        {
          "bedingung_text": "party_type = 'Person' und address_type = 'Ausland', aber mindestens eine inlaendische Betriebsstaette (5_Betriebsstaetten.country = 'Deutschland').",
          "ergebniswert": "Deutschland",
          "unsicher": false,
          "bedingung": {
            "und": [
              {
                "vergleich": {
                  "feld": "1_Allgemeiner_Stammblock.party_type",
                  "op": "eq",
                  "wert": "Person"
                }
              },
              {
                "vergleich": {
                  "feld": "1_Allgemeiner_Stammblock.address_type",
                  "op": "eq",
                  "wert": "Ausland"
                }
              }
            ]
          },
          "ausnahmen": "Beschraenkte Steuerpflicht mit inlaendischer Anknuepfung (§ 18/19 AO); das konkrete Bundesland richtet sich nach der Lage der Betriebsstaette bzw. des Grundbesitzes.",
          "offene_frage_an_nils": null
        },
        {
          "bedingung_text": "party_type = 'Firma', legal_form_jurisdiction = 'nach deutschem Recht'.",
          "ergebniswert": "Deutschland",
          "unsicher": false,
          "bedingung": {
            "und": [
              {
                "vergleich": {
                  "feld": "1_Allgemeiner_Stammblock.party_type",
                  "op": "eq",
                  "wert": "Firma"
                }
              },
              {
                "vergleich": {
                  "feld": "1_Allgemeiner_Stammblock.legal_form_jurisdiction",
                  "op": "eq",
                  "wert": "nach deutschem Recht"
                }
              }
            ]
          },